{
  "decision_id": "decision-example",
  "mode": "production",
  "symbol": null,
  "decision_time": "TO_VERIFY_RUNTIME",
  "decision": "NOT_RUN_TODAY",
  "trigger": null,
  "market_regime": null,
  "strategy_version": "CURRENT_PRODUCTION_TO_VERIFY",
  "data_snapshot_id": null,
  "gate_states": {
    "runtime": "PASS",
    "trigger": "NO_TRIGGER",
    "data_trust": "FAIL"
  },
  "reason_codes": [
    "NO_TRIGGER",
    "PIT_CONTAMINATION"
  ],
  "frozen": true
}
